{"width":130,"height":130,"cell_m":2.0,"origin":[-130.0,-130.0],"heights":[-2.12,-2.18,-2.25,-2.26,-2.22,-2.15,-2.09,-2.02,-1.95,-1.88,-1.84,-1.8,-1.77,-1.74,-1.68,-1.6,-1.51,-1.43,-1.37,-1.3,-1.22,-1.1,-0.98,-0.85,-0.72,-0.6,-0.48,-0.38,-0.29,-0.21,-0.14,-0.1,-0.11,-0.12,-0.12,-0.07,0.01,0.12,0.23,0.35,0.49,0.61,0.69,0.72,0.71,0.71,0.72,0.75,0.79,0.82,0.85,0.91,0.96,0.98,0.97,0.94,0.92,0.9,0.87,0.84,0.81,0.78,0.75,0.71,0.68,0.66,0.64,0.63,0.62,0.63,0.67,0.72,0.74,0.72,0.68,0.64,0.61,0.55,0.45,0.36,0.29,0.23,0.17,0.12,0.07,0.06,0.06,0.0,-0.14,-0.34,-0.56,-0.74,-0.86,-0.95,-1.02,-1.1,-1.16,-1.2,-1.24,-1.3,-1.39,-1.5,-1.62,-1.74,-1.88,-2.01,-2.12,-2.18,-2.23,-2.3,-2.4,-2.53,-2.68,-2.83,-2.98,-3.13,-3.26,-3.37,-3.5,-3.65,-3.8,-3.94,-4.05,-4.14,-4.18,-4.2,-4.14,-4.05,-3.96,-3.91,-2.19,-2.26,-2.29,-2.24,-2.14,-2.03,-1.92,-1.82,-1.75,-1.7,-1.68,-1.66,-1.66,-1.65,-1.63,-1.58,-1.5,-1.42,-1.34,-1.25,-1.13,-1.02,-0.9,-0.78,-0.67,-0.55,-0.43,-0.34,-0.25,-0.16,-0.09,-0.05,-0.06,-0.09,-0.09,-0.04,0.04,0.14,0.25,0.38,0.52,0.64,0.72,0.74,0.73,0.72,0.73,0.74,0.76,0.79,0.82,0.86,0.91,0.92,0.9,0.87,0.85,0.83,0.8,0.77,0.75,0.73,0.71,0.69,0.66,0.65,0.62,0.6,0.57,0.57,0.61,0.66,0.68,0.67,0.64,0.61,0.58,0.53,0.44,0.36,0.3,0.24,0.19,0.13,0.09,0.09,0.08,0.03,-0.11,-0.31,-0.53,-0.71,-0.84,-0.92,-1.0,-1.08,-1.13,-1.17,-1.2,-1.26,-1.36,-1.47,-1.58,-1.7,-1.84,-1.99,-2.1,-2.17,-2.22,-2.28,-2.39,-2.51,-2.63,-2.78,-2.94,-3.08,-3.19,-3.28,-3.36,-3.47,-3.59,-3.73,-3.88,-4.04,-4.16,-4.19,-4.13,-4.02,-3.92,-3.87,-2.27,-2.3,-2.27,-2.16,-2.01,-1.86,-1.74,-1.66,-1.62,-1.61,-1.61,-1.61,-1.61,-1.61,-1.61,-1.59,-1.54,-1.46,-1.36,-1.23,-1.07,-0.92,-0.8,-0.69,-0.58,-0.47,-0.36,-0.27,-0.19,-0.12,-0.07,-0.04,-0.05,-0.08,-0.08,-0.02,0.08,0.2,0.33,0.45,0.56,0.65,0.71,0.73,0.73,0.72,0.72,0.72,0.73,0.75,0.77,0.81,0.85,0.85,0.83,0.79,0.75,0.72,0.7,0.68,0.67,0.67,0.66,0.66,0.65,0.63,0.61,0.57,0.54,0.53,0.54,0.57,0.58,0.57,0.56,0.54,0.53,0.5,0.44,0.39,0.33,0.27,0.22,0.16,0.12,0.11,0.08,0.02,-0.1,-0.28,-0.47,-0.64,-0.77,-0.87,-0.95,-1.04,-1.11,-1.16,-1.2,-1.25,-1.33,-1.42,-1.51,-1.63,-1.78,-1.92,-2.04,-2.13,-2.2,-2.27,-2.38,-2.49,-2.65,-2.83,-2.99,-3.1,-3.18,-3.23,-3.27,-3.32,-3.39,-3.49,-3.63,-3.81,-4.0,-4.14,-4.13,-4.02,-3.92,-3.86,-2.29,-2.26,-2.16,-2.01,-1.83,-1.69,-1.62,-1.61,-1.61,-1.61,-1.61,-1.61,-1.61,-1.61,-1.61,-1.61,-1.59,-1.53,-1.42,-1.27,-1.07,-0.86,-0.7,-0.59,-0.49,-0.39,-0.29,-0.2,-0.13,-0.09,-0.06,-0.05,-0.06,-0.07,-0.07,-0.01,0.11,0.27,0.41,0.52,0.59,0.65,0.68,0.7,0.71,0.7,0.7,0.69,0.69,0.7,0.72,0.75,0.78,0.78,0.75,0.7,0.65,0.62,0.6,0.59,0.58,0.58,0.6,0.61,0.62,0.61,0.58,0.54,0.5,0.48,0.47,0.47,0.47,0.47,0.47,0.48,0.47,0.46,0.45,0.41,0.37,0.31,0.25,0.2,0.16,0.11,0.06,-0.01,-0.12,-0.25,-0.4,-0.56,-0.69,-0.8,-0.9,-0.99,-1.08,-1.16,-1.22,-1.26,-1.31,-1.36,-1.44,-1.55,-1.7,-1.84,-1.97,-2.07,-2.17,-2.26,-2.37,-2.54,-2.76,-2.95,-3.09,-3.17,-3.22,-3.23,-3.24,-3.24,-3.26,-3.3,-3.39,-3.55,-3.75,-3.97,-4.07,-4.02,-3.91,-3.85,-2.24,-2.15,-2.01,-1.83,-1.68,-1.61,-1.61,-1.61,-1.61,-1.61,-1.61,-1.61,-1.61,-1.61,-1.61,-1.61,-1.61,-1.59,-1.5,-1.35,-1.14,-0.88,-0.65,-0.52,-0.42,-0.33,-0.23,-0.14,-0.09,-0.06,-0.05,-0.05,-0.05,-0.07,-0.06,0.0,0.14,0.31,0.46,0.55,0.6,0.62,0.64,0.66,0.67,0.67,0.66,0.65,0.65,0.65,0.66,0.69,0.71,0.7,0.67,0.61,0.56,0.53,0.51,0.5,0.5,0.51,0.53,0.55,0.56,0.55,0.53,0.49,0.45,0.42,0.4,0.39,0.38,0.39,0.4,0.42,0.42,0.43,0.43,0.42,0.38,0.33,0.26,0.21,0.17,0.12,0.04,-0.04,-0.12,-0.22,-0.34,-0.49,-0.62,-0.74,-0.84,-0.94,-1.04,-1.14,-1.22,-1.26,-1.28,-1.31,-1.38,-1.49,-1.63,-1.78,-1.91,-2.03,-2.14,-2.25,-2.43,-2.68,-2.91,-3.09,-3.19,-3.23,-3.24,-3.24,-3.24,-3.24,-3.24,-3.24,-3.25,-3.33,-3.5,-3.73,-3.91,-3.97,-3.9,-3.84,-2.14,-2.02,-1.85,-1.69,-1.61,-1.61,-1.61,-1.61,-1.61,-1.61,-1.61,-1.61,-1.61,-1.61,-1.61,-1.61,-1.61,-1.61,-1.57,-1.45,-1.25,-0.97,-0.69,-0.5,-0.4,-0.3,-0.21,-0.12,-0.07,-0.04,-0.04,-0.03,-0.04,-0.05,-0.04,0.02,0.15,0.31,0.45,0.54,0.57,0.59,0.6,0.62,0.62,0.61,0.6,0.59,0.58,0.58,0.59,0.61,0.62,0.62,0.58,0.53,0.49,0.46,0.44,0.43,0.43,0.44,0.45,0.48,0.49,0.48,0.46,0.42,0.39,0.37,0.35,0.34,0.33,0.34,0.35,0.36,0.37,0.38,0.39,0.38,0.35,0.3,0.25,0.21,0.17,0.12,0.05,-0.02,-0.1,-0.19,-0.3,-0.44,-0.57,-0.69,-0.79,-0.89,-1.0,-1.1,-1.18,-1.23,-1.26,-1.29,-1.36,-1.48,-1.62,-1.76,-1.89,-2.01,-2.13,-2.27,-2.54,-2.83,-3.07,-3.2,-3.24,-3.24,-3.24,-3.24,-3.24,-3.24,-3.24,-3.24,-3.24,-3.24,-3.31,-3.49,-3.71,-3.85,-3.88,-3.83,-2.06,-1.9,-1.73,-1.62,-1.61,-1.61,-1.61,-1.61,-1.61,-1.61,-1.61,-1.61,-1.61,-1.61,-1.61,-1.61,-1.61,-1.61,-1.61,-1.53,-1.35,-1.08,-0.77,-0.52,-0.4,-0.31,-0.22,-0.14,-0.08,-0.05,-0.04,-0.03,-0.02,-0.02,0.0,0.06,0.17,0.3,0.41,0.48,0.52,0.54,0.56,0.56,0.55,0.53,0.52,0.51,0.51,0.5,0.51,0.52,0.52,0.5,0.47,0.45,0.42,0.4,0.38,0.37,0.37,0.37,0.39,0.41,0.41,0.41,0.39,0.36,0.33,0.31,0.29,0.28,0.27,0.28,0.29,0.3,0.3,0.31,0.33,0.33,0.3,0.27,0.23,0.2,0.16,0.12,0.06,-0.0,-0.08,-0.17,-0.27,-0.4,-0.54,-0.67,-0.79,-0.9,-0.99,-1.08,-1.16,-1.22,-1.27,-1.33,-1.41,-1.53,-1.66,-1.79,-1.91,-2.03,-2.14,-2.37,-2.7,-2.99,-3.18,-3.24,-3.24,-3.24,-3.24,-3.24,-3.24,-3.24,-3.24,-3.24,-3.24,-3.24,-3.24,-3.32,-3.52,-3.71,-3.83,-3.85,-1.98,-1.81,-1.66,-1.61,-1.61,-1.61,-1.61,-1.61,-1.61,-1.61,-1.56,-1.54,-1.51,-1.47,-1.42,-1.38,-1.33,-1.27,-1.22,-1.16,-1.09,-1.03,-0.96,-0.9,-0.83,-0.77,-0.7,-0.64,-0.58,-0.52,-0.46,-0.41,-0.36,-0.32,-0.28,-0.24,-0.2,-0.17,-0.15,-0.12,-0.1,-0.08,-0.07,-0.05,-0.04,-0.03,-0.03,-0.02,-0.02,-0.02,-0.02,-0.02,-0.02,-0.02,-0.02,-0.02,-0.02,-0.03,-0.03,-0.03,-0.04,-0.04,-0.05,-0.05,-0.05,-0.06,-0.06,-0.07,-0.08,-0.08,-0.09,-0.1,-0.11,-0.12,-0.13,-0.14,-0.16,-0.18,-0.2,-0.22,-0.25,-0.28,-0.31,-0.35,-0.39,-0.43,-0.48,-0.53,-0.59,-0.65,-0.72,-0.78,-0.86,-0.93,-1.01,-1.09,-1.18,-1.27,-1.36,-1.45,-1.55,-1.64,-1.74,-1.84,-1.93,-2.03,-2.12,-2.21,-2.3,-2.38,-2.46,-2.54,-2.61,-2.67,-2.73,-2.79,-2.84,-2.88,-2.92,-2.94,-3.07,-3.24,-3.24,-3.24,-3.24,-3.25,-3.38,-3.59,-3.78,-3.87,-1.91,-1.74,-1.62,-1.61,-1.61,-1.61,-1.61,-1.61,-1.56,-1.54,-1.52,-1.5,-1.47,-1.43,-1.38,-1.34,-1.29,-1.23,-1.18,-1.12,-1.05,-0.99,-0.92,-0.86,-0.79,-0.73,-0.66,-0.6,-0.54,-0.48,-0.42,-0.37,-0.32,-0.28,-0.24,-0.2,-0.16,-0.13,-0.11,-0.08,-0.06,-0.04,-0.03,-0.01,-0.0,0.01,0.01,0.02,0.02,0.02,0.02,0.02,0.02,0.02,0.02,0.02,0.02,0.01,0.01,0.01,0.0,-0.0,-0.01,-0.01,-0.01,-0.02,-0.02,-0.03,-0.04,-0.04,-0.05,-0.06,-0.07,-0.08,-0.09,-0.1,-0.12,-0.14,-0.16,-0.18,-0.21,-0.24,-0.27,-0.31,-0.35,-0.39,-0.44,-0.49,-0.55,-0.61,-0.68,-0.74,-0.82,-0.89,-0.97,-1.05,-1.14,-1.23,-1.32,-1.41,-1.51,-1.6,-1.7,-1.8,-1.89,-1.99,-2.08,-2.17,-2.26,-2.34,-2.42,-2.5,-2.57,-2.63,-2.69,-2.75,-2.8,-2.84,-2.88,-2.9,-2.91,-2.94,-3.24,-3.24,-3.24,-3.24,-3.3,-3.48,-3.71,-3.86,-1.84,-1.69,-1.61,-1.61,-1.61,-1.61,-1.61,-1.61,-1.54,-1.5,-1.48,-1.46,-1.43,-1.39,-1.34,-1.3,-1.25,-1.19,-1.14,-1.08,-1.01,-0.95,-0.88,-0.82,-0.75,-0.69,-0.62,-0.56,-0.5,-0.44,-0.38,-0.33,-0.28,-0.24,-0.2,-0.16,-0.12,-0.09,-0.07,-0.04,-0.02,-0.0,0.01,0.03,0.04,0.05,0.05,0.06,0.06,0.06,0.06,0.06,0.06,0.06,0.06,0.06,0.06,0.05,0.05,0.05,0.04,0.04,0.03,0.03,0.03,0.02,0.02,0.01,0.0,-0.0,-0.01,-0.02,-0.03,-0.04,-0.05,-0.06,-0.08,-0.1,-0.12,-0.14,-0.17,-0.2,-0.23,-0.27,-0.31,-0.35,-0.4,-0.45,-0.51,-0.57,-0.64,-0.7,-0.78,-0.85,-0.93,-1.01,-1.1,-1.19,-1.28,-1.37,-1.47,-1.56,-1.66,-1.76,-1.85,-1.95,-2.04,-2.13,-2.22,-2.3,-2.38,-2.46,-2.53,-2.59,-2.65,-2.71,-2.76,-2.8,-2.84,-2.86,-2.88,-2.91,-3.07,-3.24,-3.24,-3.24,-3.26,-3.41,-3.62,-3.81,-1.78,-1.66,-1.61,-1.61,-1.61,-1.61,-1.61,-1.56,-1.52,-1.48,-1.45,-1.42,-1.39,-1.35,-1.3,-1.26,-1.21,-1.15,-1.1,-1.04,-0.97,-0.91,-0.84,-0.78,-0.71,-0.65,-0.58,-0.52,-0.46,-0.4,-0.35,-0.29,-0.24,-0.2,-0.16,-0.12,-0.08,-0.05,-0.03,-0.0,0.02,0.04,0.05,0.07,0.08,0.09,0.09,0.1,0.1,0.1,0.1,0.1,0.1,0.1,0.1,0.1,0.1,0.09,0.09,0.09,0.08,0.08,0.07,0.07,0.07,0.06,0.06,0.05,0.04,0.04,0.03,0.02,0.01,0.0,-0.01,-0.02,-0.04,-0.06,-0.08,-0.1,-0.13,-0.16,-0.19,-0.23,-0.27,-0.31,-0.36,-0.41,-0.47,-0.53,-0.6,-0.66,-0.74,-0.81,-0.89,-0.97,-1.06,-1.15,-1.24,-1.33,-1.43,-1.52,-1.62,-1.72,-1.81,-1.91,-2.0,-2.09,-2.18,-2.26,-2.34,-2.42,-2.49,-2.55,-2.61,-2.67,-2.72,-2.76,-2.8,-2.83,-2.86,-2.9,-2.94,-3.24,-3.24,-3.24,-3.25,-3.36,-3.54,-3.73,-1.73,-1.65,-1.61,-1.61,-1.61,-1.61,-1.61,-1.56,-1.52,-1.48,-1.45,-1.42,-1.38,-1.34,-1.3,-1.25,-1.2,-1.15,-1.09,-1.03,-0.97,-0.91,-0.84,-0.77,-0.71,-0.64,-0.58,-0.52,-0.45,-0.4,-0.34,-0.29,-0.24,-0.19,-0.15,-0.11,-0.08,-0.05,-0.02,0.0,0.02,0.04,0.06,0.07,0.08,0.09,0.1,0.1,0.1,0.11,0.11,0.11,0.11,0.11,0.1,0.1,0.1,0.1,0.09,0.09,0.09,0.08,0.08,0.07,0.07,0.06,0.06,0.05,0.05,0.04,0.03,0.03,0.02,0.01,-0.01,-0.02,-0.04,-0.06,-0.08,-0.1,-0.13,-0.16,-0.19,-0.23,-0.27,-0.31,-0.36,-0.41,-0.47,-0.53,-0.59,-0.66,-0.73,-0.81,-0.89,-0.97,-1.06,-1.15,-1.24,-1.33,-1.42,-1.52,-1.62,-1.71,-1.81,-1.9,-2.0,-2.09,-2.17,-2.26,-2.34,-2.41,-2.48,-2.55,-2.61,-2.66,-2.71,-2.76,-2.8,-2.82,-2.86,-2.9,-2.94,-3.24,-3.24,-3.24,-3.25,-3.33,-3.47,-3.65,-1.68,-1.64,-1.61,-1.61,-1.61,-1.61,-1.61,-1.61,-1.53,-1.5,-1.48,-1.46,-1.42,-1.38,-1.34,-1.29,-1.24,-1.19,-1.13,-1.07,-1.01,-0.95,-0.88,-0.81,-0.75,-0.68,-0.62,-0.56,-0.49,-0.44,-0.38,-0.33,-0.28,-0.23,-0.19,-0.15,-0.12,-0.09,-0.06,-0.04,-0.02,0.0,0.02,0.03,0.04,0.05,0.06,0.06,0.06,0.07,0.07,0.07,0.07,0.07,0.06,0.06,0.06,0.06,0.05,0.05,0.05,0.04,0.04,0.03,0.03,0.02,0.02,0.01,0.01,0.0,-0.01,-0.01,-0.02,-0.03,-0.05,-0.06,-0.08,-0.1,-0.12,-0.14,-0.17,-0.2,-0.23,-0.27,-0.31,-0.35,-0.4,-0.45,-0.51,-0.57,-0.63,-0.7,-0.77,-0.85,-0.93,-1.01,-1.1,-1.19,-1.28,-1.37,-1.46,-1.56,-1.66,-1.75,-1.85,-1.94,-2.04,-2.13,-2.21,-2.3,-2.38,-2.45,-2.52,-2.59,-2.65,-2.7,-2.75,-2.8,-2.84,-2.86,-2.88,-2.91,-3.03,-3.24,-3.24,-3.24,-3.25,-3.32,-3.43,-3.59,-1.65,-1.63,-1.61,-1.61,-1.61,-1.61,-1.61,-1.61,-1.56,-1.53,-1.52,-1.5,-1.46,-1.42,-1.38,-1.33,-1.28,-1.23,-1.17,-1.11,-1.05,-0.99,-0.92,-0.85,-0.79,-0.72,-0.66,-0.6,-0.53,-0.48,-0.42,-0.37,-0.32,-0.27,-0.23,-0.19,-0.16,-0.13,-0.1,-0.08,-0.06,-0.04,-0.02,-0.01,0.0,0.01,0.02,0.02,0.02,0.03,0.03,0.03,0.03,0.03,0.02,0.02,0.02,0.02,0.01,0.01,0.01,0.0,-0.0,-0.01,-0.01,-0.02,-0.02,-0.03,-0.03,-0.04,-0.05,-0.05,-0.06,-0.07,-0.09,-0.1,-0.12,-0.14,-0.16,-0.18,-0.21,-0